{
  "apiVersion": "launchroom.vantezzen.io/v1",
  "kind": "EnrollRequest",
  "token": "lr_jt_Zm9vYmFyYmF6cXV4cXV1eA",
  "signingKey": "ed25519:A6EHv/POEL4dcN0Y50vAmWfk1jCbpQ1fHdyGZBJVMbg=",
  "sealingKey": "x25519:LXEWQrcmsEQBYnyp+6wy9chTD7GQPMTbAiWHF5IaSIE=",
  "daemonVersion": "0.1.0",
  "protocolVersions": [
    "v1"
  ],
  "host": {
    "hostname": "web-1",
    "os": "linux",
    "arch": "arm64",
    "cpus": 4,
    "memoryMb": 8192
  }
}
